{
  "catalog_id": "source-spectral-profiles",
  "catalog_version": "v0.1.0",
  "schema_ref": "source-spectral-profile.schema.json",
  "spec_ref": "model-extension-2-spec-v0.2.1-§6-§17.1",
  "description": "Conservative starter source spectral profile entries for Extension 2 exploratory mode. All entries are generic and research-flagged where appropriate. Do not interpret these as measured material performance.",
  "entries": [
    {
      "profile_id": "compute_h200_warm_band",
      "label": "H200-Class Compute — Warm Band",
      "profile_class": "compute_die_band",
      "source_type": "gpu_accelerator_package",
      "temperature_basis_min_k": 320,
      "temperature_basis_nominal_k": 345,
      "temperature_basis_max_k": 370,
      "wavelength_band_min_um": 7.8,
      "wavelength_band_peak_um": 8.4,
      "wavelength_band_max_um": 9.5,
      "emissivity_basis": 0.7,
      "provenance_class": "analog_estimated",
      "maturity_class": "modeled_only",
      "confidence_class": "low",
      "source_note": "Wien-law derived from nominal die temperature range for H200-class devices. Cold-plate transport target ~300–330 K; die junction may reach 340–370 K. Emissivity basis is generic silicon/package estimate. Not a measured device spectrum.",
      "research_required": true
    },
    {
      "profile_id": "compute_h200_hotspot_band",
      "label": "H200-Class Compute — Hotspot Band",
      "profile_class": "package_hotspot_band",
      "source_type": "gpu_accelerator_package",
      "temperature_basis_min_k": 340,
      "temperature_basis_nominal_k": 365,
      "temperature_basis_max_k": 393,
      "wavelength_band_min_um": 7.3,
      "wavelength_band_peak_um": 7.9,
      "wavelength_band_max_um": 9.0,
      "emissivity_basis": 0.6,
      "provenance_class": "analog_estimated",
      "maturity_class": "modeled_only",
      "confidence_class": "low",
      "source_note": "Represents hotspot zone within a high-TDP accelerator package. Peak junction temperature TJ,max = 120 C (393 K) is manufacturer maximum, not typical operating condition. Emissivity basis is conservative estimate for encapsulated silicon hotspot. Not a measured spectrum.",
      "research_required": true
    },
    {
      "profile_id": "warm_transport_backbone_band",
      "label": "Warm Transport Backbone Band",
      "profile_class": "warm_transport_band",
      "source_type": "pumped_liquid_loop_transport",
      "temperature_basis_min_k": 310,
      "temperature_basis_nominal_k": 330,
      "temperature_basis_max_k": 355,
      "wavelength_band_min_um": 8.1,
      "wavelength_band_peak_um": 8.8,
      "wavelength_band_max_um": 10.2,
      "emissivity_basis": 0.85,
      "provenance_class": "analog_estimated",
      "maturity_class": "heritage_analog",
      "confidence_class": "low",
      "source_note": "Representative of warm-side transport fluid temperature range. Emissivity basis reflects generic fluid or transport surface. Not a measured spectrum of a specific fluid.",
      "research_required": true
    },
    {
      "profile_id": "regen_hot_island_band",
      "label": "Regenerative Hot Island Band",
      "profile_class": "hot_island_band",
      "source_type": "thermal_storage_regen_zone",
      "temperature_basis_min_k": 700,
      "temperature_basis_nominal_k": 900,
      "temperature_basis_max_k": 1100,
      "wavelength_band_min_um": 2.6,
      "wavelength_band_peak_um": 3.2,
      "wavelength_band_max_um": 4.5,
      "emissivity_basis": 0.8,
      "provenance_class": "placeholder",
      "maturity_class": "concept_only",
      "confidence_class": "unknown",
      "source_note": "Placeholder for a thermally elevated hot-island zone fed by staged spectral concentration. No hardware demonstration exists for this temperature range via waste-heat concentration from compute sources. Temperature basis is speculative target, not an achieved state. Treat as directional only.",
      "research_required": true
    },
    {
      "profile_id": "solar_polished_hot_island_band",
      "label": "Solar-Polished Hot Island Band",
      "profile_class": "solar_polished_hot_island_band",
      "source_type": "solar_augmented_hot_island",
      "temperature_basis_min_k": 900,
      "temperature_basis_nominal_k": 1200,
      "temperature_basis_max_k": 1500,
      "wavelength_band_min_um": 1.9,
      "wavelength_band_peak_um": 2.4,
      "wavelength_band_max_um": 3.4,
      "emissivity_basis": 0.85,
      "provenance_class": "hypothesis_only",
      "maturity_class": "concept_only",
      "confidence_class": "unknown",
      "source_note": "Highly speculative placeholder for a solar-concentration-augmented hot island in GEO orbit. GEO solar irradiance ~1361 W/m² is real; the achievable temperature with concentrator and this architecture combination is unvalidated. Do not treat as achievable performance. Research required before any engineering commitment.",
      "research_required": true
    }
  ]
}
